status_id,created_at,year,screen_name,text,favorite_count,retweet_count,hashtags,display_text_widthx713131098969083904,3/24/16,2016,realDonaldTrump,"I didn't start the fight with Lyin'Ted Cruz over the GQ cover pic of Melania, he did. He knew the PAC was putting it out - hence, Lyin' Ted!",26023,9093,,140x757343025983057922,7/24/16,2016,realDonaldTrump,"The highly neurotic Debbie Wasserman Schultz is angry that, after stealing and cheating her way to a Crooked Hillary victory, she's out!",28477,9073,,136x713030660475240448,3/24/16,2016,realDonaldTrump,"Just announced that as many as 5000 ISIS fighters have infiltrated Europe. Also, many in U.S.  I TOLD YOU SO! I alone can fix this problem!",21440,9066,,139x756952917152784384,7/23/16,2016,realDonaldTrump,Just saw Crooked Hillary and Tim Kaine together. ISIS and our other enemies are drooling. They don't look presidential to me!,30045,9064,,125x775361266001084416,9/12/16,2016,realDonaldTrump,Stopped by @TrumpDC to thank all of the tremendous men &amp; women for their hard work! https://t.co/oGcJL4N454,29979,9058,,87x790924363348541445,10/25/16,2016,realDonaldTrump,#Obamacare premiums are about to SKYROCKET --- again. Crooked H will only make it worse. We will repeal &amp; replace! https://t.co/fY1REYV4rK,16047,9057,Obamacare,142x756697615509688320,7/23/16,2016,realDonaldTrump,I highly recommend the just out book - THE FIELD OF FIGHT - by General Michael Flynn. How to defeat radical Islam.,21852,9052,,114x706675395811266560,3/7/16,2016,realDonaldTrump,How do you fight millions of dollars of fraudulent commercials pushing for crooked politicians? I will be using Facebook &amp; Twitter. Watch!,25564,9052,,142x707225317648240640,3/8/16,2016,realDonaldTrump,MAKE AMERICA GREAT AGAIN!,17542,9051,,25x764799933325144064,8/14/16,2016,realDonaldTrump,The failing @nytimes talks about anonymous sources and meetings that never happened. Their reporting is fiction. The media protects Hillary!,26963,9048,,140x771206171856207873,9/1/16,2016,realDonaldTrump,RT @LouDobbs: We are Watching A Leader Who for the First Time in Three Presidencies Will Put America and Americans First! @realDonaldTrumpäó_,0,9046,,139x757206444148158464,7/24/16,2016,realDonaldTrump,"Sorry folks, but Bernie Sanders is exhausted, just can't go on any longer. He is trying to dismiss the new e-mails and DNC disrespect. SAD!",27141,9046,,139x771687247951298560,9/2/16,2016,realDonaldTrump,People will be very surprised by our ground game on Nov. 8. We have an army of volunteers and people with GREAT SPIRIT! They want to #MAGA!,26898,9038,MAGA,139x766760721115938816,8/19/16,2016,realDonaldTrump,Thank you Michigan. This is a MOVEMENT. We are going to MAKE AMERICA SAFE AND GREAT AGAIN! #TrumpPence16 https://t.co/vP3eqF3Zbb,28852,9024,TrumpPence16,104x756866912848584704,7/23/16,2016,realDonaldTrump,Funny that the Democrats would have their convention in Pennsylvania where her husband and her killed so many jobs. I will bring jobs back!,28920,9021,,139x759372422692954112,7/30/16,2016,realDonaldTrump,We are suffering through the worst long-term unemployment in the last 70 years. I want change - Crooked Hillary Clinton does not.,26624,9019,,129x717321031321432064,4/5/16,2016,realDonaldTrump,Good morning Wisconsin! The polls are now open! #VoteTrump today &amp; we will MakeAmericaGreatAgain! https://t.co/cXvX5SCF3c,19575,9017,VoteTrump,125x756138994728071168,7/21/16,2016,realDonaldTrump,"Other than a small group of people who have suffered massive and embarrassing losses, the party is VERY united. Great love in the arena!",36009,9010,,136x749698321074180096,7/3/16,2016,realDonaldTrump,Only a fool would believe that the meeting between Bill Clinton and the U.S.A.G. was not arranged or that Crooked Hillary did not know.,25521,9009,,135x788921907835830272,10/20/16,2016,realDonaldTrump,"Crooked's camp incited violence at my rallies. These incidents weren't ""spontaneous"" - like she claimed in Benghazi! https://t.co/aCzOgFIfZ2",14249,9005,,140x783393314309484544,10/4/16,2016,realDonaldTrump,"My childcare plan makes a difference for working families - more money, more freedom. #AmericaFirst means #FamilyFirst! https://t.co/MO6i0RSUbp",21639,9002,AmericaFirst FamilyFirst,119x757571837463240704,7/25/16,2016,realDonaldTrump,"Here we go again with another Clinton scandal, and e-mails yet (can you believe). Crooked Hillary knew the fix was in, B never had a chance!",28482,9000,,140x764529295901528064,8/13/16,2016,realDonaldTrump,The failing @nytimes has become a newspaper of fiction. Their stories about me always quote non-existent unnamed sources. Very dishonest!,27599,8997,,137x725396879723384832,4/27/16,2016,realDonaldTrump,Agreed! https://t.co/biyldP3CIw,18623,8992,,7x795346759119736832,11/6/16,2016,realDonaldTrump,"Thank you Iowa - Get out &amp; #VoteTrumpPence16! https://t.co/HfihPERFgZ https://t.co/QsukELQmKb",25728,8991,VoteTrumpPence16,74x790227242500644864,10/23/16,2016,realDonaldTrump,"Thank you Las Vegas Review Journal! EDITORIAL: 'Donald Trump for president' https://t.co/uH5GH7Bhe0 via @reviewjournal",18333,8990,,119x760185303483187201,8/1/16,2016,realDonaldTrump,People believe CNN these days almost as little as they believe Hillary....that's really saying something!,28148,8981,,105x769001435484688384,8/26/16,2016,realDonaldTrump,"Hillary Clinton only knows how to make a speech when it is a hit on me. No policy, and always very short (stamina). Media gives her a pass!",25847,8976,,139x757315800466272256,7/24/16,2016,realDonaldTrump,"The @CNN panels are so one sided, almost all against Trump. @FoxNews is so much better and the ratings are much higher. Don't watch CNN!",29059,8974,,136x805088569765359616,12/3/16,2016,realDonaldTrump,"""@TigerWoods: Canäó»t wait to get back out there and mix it up with the boys. äóñTW #heroworldchallenge"" Great to have you back Tiger - Special!",36448,8971,heroworldchallenge,140x699989532180135936,2/17/16,2016,realDonaldTrump,"Jeb Bush just got contact lenses and got rid of the glasses. He wants to look cool, but it's far too late. 1% in Nevada!",17239,8970,,120x805127720749383680,12/3/16,2016,realDonaldTrump,"Our great VPE, @mike_pence, is in Louisiana campaigning for John Kennedy for US Senate. John will be a tremendous help to us in Washington.",37762,8955,,139x793155579019681792,10/31/16,2016,realDonaldTrump,$25 Million+ raised online in just one week! RECORD WEEK. #DrainTheSwamp Today we set a bigger record. Contribute &gt;https://t.co/CZ1QmzCxwO,20518,8953,DrainTheSwamp,141x737996614573260800,6/1/16,2016,realDonaldTrump,"So I raised/gave $5,600,000 for the veterans and the media makes me look bad! They do anything to belittle - totally biased.",28093,8948,,124x769571710924263424,8/27/16,2016,realDonaldTrump,Dwyane Wade's cousin was just shot and killed walking her baby in Chicago. Just what I have been saying. African-Americans will VOTE TRUMP!,26039,8943,,139x778202693215068161,9/20/16,2016,realDonaldTrump,"Crooked Hillary has been fighting ISIS, or whatever she has been doing, for years. Now she has new ideas. It is time for change.",26275,8926,,128x714175472557424640,3/27/16,2016,realDonaldTrump,"Happy Easter to all, have a great day!",30859,8926,,38x742069634652835841,6/12/16,2016,realDonaldTrump,"""@WandaWalls20: @realDonaldTrump Please make us safe. We cannot have Hillary as president. We will be in so much trouble.",29232,8923,,121x793563282854383617,11/1/16,2016,realDonaldTrump,Hillary Advisers Wanted Her To Avoid Supporting Israel When Talking To Democrats: https://t.co/y7m8iVU173,14426,8908,,105x741965111968075776,6/12/16,2016,realDonaldTrump,Really bad shooting in Orlando. Police investigating possible terrorism. Many people dead and wounded.,24985,8908,,102x783847514088824832,10/6/16,2016,realDonaldTrump,"Nation's Immigration And Customs Enforcement Officers (ICE) Make First-Ever Presidential Endorsement:https://t.co/eO1UY5N9J1",19194,8904,,125x803423503978532864,11/29/16,2016,realDonaldTrump,"""@sdcritic:  @HighonHillcrest @jeffzeleny @CNN There is NO QUESTION THAT #voterfraud did take place, and in favor of #CorruptHillary !""",32060,8890,voterfraud CorruptHillary,135x714503667261562880,3/28/16,2016,realDonaldTrump,"A detainee released from Gitmo has killed an American. When will our so-called ""leaders"" ever learn!",19931,8890,,100x811021135483699201,12/20/16,2016,realDonaldTrump,RT @DanScavino: #TrumpTrain_ô_‰_ôÍÂ_ôˆ__ôˆŸ_ôˆ__ôˆŸ_ôˆ__ôˆŸ_ôˆ__ôˆŸ https://t.co/qAQdBGEwSv,0,8881,TrumpTrain,61x721695114943442946,4/17/16,2016,realDonaldTrump,Crooked Hillary Clinton is spending a fortune on ads against me. I am the one person she doesn't want to run against. Will be such fun!,26191,8880,,135x807427326522884096,12/10/16,2016,realDonaldTrump,"Thank you Michigan. We are going to bring back your jobs &amp; together, we will MAKE AMERICA GREAT AGAIN!Watch: https://t.co/cJK323RDYl https://t.co/JjhIdFXCGV",36805,8877,,137x795834203430645760,11/8/16,2016,realDonaldTrump,"Unbelievable evening in New Hampshire - THANK YOU! Flying to Grand Rapids, Michigan now. Watch NH rally here: https://t.co/5ajbpTtQuK https://t.co/cdRfnxIZqj",31111,8863,,134x784149222870351872,10/6/16,2016,realDonaldTrump,VOTE #TrumpPence16 on 11/8/16! https://t.co/12zAk8VmgK,18278,8863,TrumpPence16,30x779503099492831233,9/24/16,2016,realDonaldTrump,"Crooked Hillary's bad judgement forced her to announce that she would go to Charlotte on Saturday to grandstand. Dem pols said no way, dumb!",26692,8861,,140x788955427975393281,10/20/16,2016,realDonaldTrump,"Join the MOVEMENT to #MAGA!https://t.co/3KWOl2ibaW https://t.co/V84qfN4oz1",18430,8860,MAGA,51x759450053379579905,7/30/16,2016,realDonaldTrump,"Violent crime is rising across the United States, yet the DNC convention ignored it. Crime reduction will be one of my top priorities.",27995,8860,,134x745969778267926532,6/23/16,2016,realDonaldTrump,"ISIS threatens us today because of the decisions Hillary Clinton has made along with President Obama.""  --  Donald J. Trump",23581,8851,,123x780593298247483392,9/27/16,2016,realDonaldTrump,Hillary Clinton is the only candidate on stage who voted for the Iraq War. #Debates2016 #MAGA https://t.co/Um5WJXEEKr,19778,8846,Debates2016 MAGA,117x754305404302139392,7/16/16,2016,realDonaldTrump,"Crooked Hillary Clinton is bought and paid for by Wall Street, lobbyists and special interests. She will sell our country down the tubes!",25654,8844,,137x761549461893984256,8/5/16,2016,realDonaldTrump,"Hillary Clinton has bad judgment and is unfit to serve as President.https://t.co/3EzG620fpT",24970,8831,,92x747888895581372416,6/28/16,2016,realDonaldTrump,"Hillary Clintonäó»s Presidency would be catastrophic forthe future of our country. She is ill-fit with bad judgment.",24427,8826,,115x747227503329173505,6/27/16,2016,realDonaldTrump,"""@brazosboys: Hillary read ""sigh"" off the Teleprompter, She's so fake she has to be told how to feel: https://t.co/ENXliW2m77 @FoxNews",19912,8820,,134x760213628926779392,8/1/16,2016,realDonaldTrump,"Thank you Oklahoma &amp; Virginia! #MakeAmericaGreatAgain #ImWithYou https://t.co/WUdY7feRvV",24840,8817,MakeAmericaGreatAgain ImWithYou,69x807347429062443009,12/9/16,2016,realDonaldTrump,Thank you Louisiana! Get out &amp; vote for John Kennedy tomorrow. Electing Kennedy will help enact our agenda on behalf of the people. https://t.co/5Fzamedm1F,35074,8814,,135x795779987152523264,11/8/16,2016,realDonaldTrump,"Thank you Pennsylvania! Going to New Hampshire now and on to Michigan. Watch PA rally here: https://t.co/d29DLINGstThe big vote tomorrow! https://t.co/E2t1C7dmYj",28360,8811,,138x769552592158412800,8/27/16,2016,realDonaldTrump,"""@DiamondandSilk: Crooked Hillary getting desperate. On TV bashing Trump. @CNN, she forgot how she said a KKK member was her mentor.",20847,8804,,132x780781898071207940,9/27/16,2016,realDonaldTrump,"Thank you! #TrumpWon #MAGA https://t.co/a5rr1i38km",19258,8802,TrumpWon MAGA,51x785291804816052225,10/10/16,2016,realDonaldTrump,Obama and Clinton told the same lie to sell #ObamaCare. #Debates2016 https://t.co/vhOLtHrR66,15743,8793,ObamaCare Debates2016,68x783129603363659776,10/4/16,2016,realDonaldTrump,"Thank you Colorado! #MAGAhttps://t.co/3KWOl20zMmhttps://t.co/M7QhdCgRzw https://t.co/wIGNtKPA2X",20200,8783,MAGA,73x769003323856867328,8/26/16,2016,realDonaldTrump,"""@DonaldJTrumpJr: Company Gouging Price Of EpiPens Is A Clinton Foundation Donor And Partner https://t.co/HHlNGnlGMN via dailycaller""",15455,8782,,133x713820823665119232,3/26/16,2016,realDonaldTrump,"Don't believe the @FoxNews Polls, they are just another phony hit job on me. I will beat Hillary Clinton easily in the General Election.",28038,8767,,136x802861553905238017,11/27/16,2016,realDonaldTrump,"during a general election. I, for one, am appalled that somebody that is the nominee of one of our two major parties would take that kind --",36396,8751,,140x745260520282951681,6/21/16,2016,realDonaldTrump,I will be making a big speech tomorrow to discuss the failed policies and bad judgment of Crooked Hillary Clinton.,25844,8744,,114x741760911044685824,6/11/16,2016,realDonaldTrump,Riley Rone was a great young man. We will miss him dearly. https://t.co/R0tm44nMao,22670,8743,,58x690404308010057728,1/22/16,2016,realDonaldTrump,RT @williebosshog: Make America Great Again! #Trump2016 https://t.co/1h5j4DZDgy,0,8740,Trump2016,79x786340623804751872,10/12/16,2016,realDonaldTrump,"I will be in Cincinnati, Ohio tomorrow night at 7:30pm- join me! #OhioVotesEarly #VoteTrumpPence16 Tickets: https://t.co/XlHGD1VrMo https://t.co/XUFuGc4Fg5",21100,8739,OhioVotesEarly VoteTrumpPence16,132x699913243251339265,2/17/16,2016,realDonaldTrump,"Interesting how President Obama so haltingly said I ""would never be president"" - This from perhaps the worst president in U.S. history!",21518,8729,,135x746560976921706500,6/25/16,2016,realDonaldTrump,Thoughts and prayers are with everyone in West Virginia- dealing with the devastating floods. #ImWithYou,25789,8727,ImWithYou,104x783492506319069184,10/5/16,2016,realDonaldTrump,".@HillaryClintonäó»s Careless Use Of A Secret Server Put National Security At Risk: https://t.co/OiAEMnrGcy #VPDebate#BigLeagueTruth",20969,8725,VPDebate BigLeagueTruth,131x782331741369462784,10/1/16,2016,realDonaldTrump,Heading to Pennsylvania for a big rally tonight. We will MAKE AMERICA GREAT AGAIN!,28160,8716,,82x780859319319400448,9/27/16,2016,realDonaldTrump,Great afternoon in Little Havana with Hispanic community leaders. Thank you for your support! #ImWithYou https://t.co/vxWZ2tyJTF,22814,8711,ImWithYou,104x791030789001605126,10/25/16,2016,realDonaldTrump,"Get your ballots in Colorado - I will see you soon -- and we will win!#MakeAmericaGreatAgain https://t.co/oDLvZg7MLk",20672,8704,MakeAmericaGreatAgain,93x783478918087004160,10/5/16,2016,realDonaldTrump,"""@Jnelson52722: @realDonaldTrump @Susiesentinel Kaine looks like an evil crook out of the Batman movies""",26977,8704,,104x757565892146454532,7/25/16,2016,realDonaldTrump,"Crooked Hillary Clinton knew everything that her ""servant"" was doing at the DNC - they just got caught, that's all! They laughed at Bernie.",25956,8703,,139x769592508879892480,8/27/16,2016,realDonaldTrump,"My condolences to Dwyane Wade and his family, on the loss of Nykea Aldridge. They are in my thoughts and prayers.",29412,8702,,113x769203012250112006,8/26/16,2016,realDonaldTrump,I am very proud to have brought the subject of illegal immigration back into the discussion. Such a big problem for our country-I will solve,30251,8699,,140x771206056454127616,9/1/16,2016,realDonaldTrump,"RT @AnnCoulter: I hear Churchill had a nice turn of phrase, but Trump's immigration speech is the most magnificent speech ever given.",0,8683,,133x769170204941164544,8/26/16,2016,realDonaldTrump,"Crooked Hillary will NEVER be able to solve the problems of poverty, education and safety within the African-American &amp; Hispanic communities",27010,8674,,144x809571983428120577,12/16/16,2016,realDonaldTrump,"Thank you Pennsylvania! Together, we are going to MAKE AMERICA GREAT AGAIN! Watch here: https://t.co/7R382qWfWS#ThankYouTour2016 https://t.co/Odd2JSTvkn",36685,8667,ThankYouTour2016,129x715616148335759360,3/31/16,2016,realDonaldTrump,"Just had a very nice meeting with @Reince Priebus and the @GOP. Looking forward to bringing the Party together --- and it will happen!",24488,8667,,135x737243856144629760,5/30/16,2016,realDonaldTrump,Have a great Memorial Day and remember that we will soon MAKE AMERICA GREAT AGAIN!,24200,8659,,82x756864330054893568,7/23/16,2016,realDonaldTrump,Crooked Hillary Clinton has destroyed jobs and manufacturing in Pennsylvania. Against steelworkers and miners. Husband signed NAFTA.,25116,8658,,132x694149534918651905,2/1/16,2016,realDonaldTrump,It all begins today - WE WILL FINALLY TAKE OUR COUNTRY BACK AND MAKE AMERICA GREAT AGAIN!,20501,8657,,89x751889266934964224,7/9/16,2016,realDonaldTrump,"New poll - thank you! #Trump2016https://t.co/Mi87Vmw06H https://t.co/WmqvcYG4r3",22381,8655,Trump2016,56x786658827429154816,10/13/16,2016,realDonaldTrump,Just left a great rally in Florida - now heading to Ohio for two more. Will be there soon.,29624,8652,,90x785301286816210944,10/10/16,2016,realDonaldTrump,This is the definition of ransom äåˆ https://t.co/370piI2JLp,16930,8652,,34x783489985718517760,10/5/16,2016,realDonaldTrump,ICYMI: PENCE: I RAN A STATE THAT WORKED; KAINE RAN A STATE THAT FAILED. https://t.co/XuWaueNkH0,21160,8648,,95x783842408949841921,10/6/16,2016,realDonaldTrump,"Such a great honor! https://t.co/vt4AmLdkeP",18605,8648,,44x718636301587771392,4/9/16,2016,realDonaldTrump,"Isn't it a shame that the person who will have by far the most delegates and many millions more votes than anyone else, me, still must fight",26737,8646,,140x693280682534137856,1/30/16,2016,realDonaldTrump,Hillary Clinton is a major national security risk. Not presidential material!,19038,8646,,77x759512042906587137,7/30/16,2016,realDonaldTrump,"The ""Rust Belt"" was created by politicians like the Clintons who allowed our jobs to be stolen from us by other countries like Mexico. END!",25770,8642,,139x811196778779463684,12/20/16,2016,realDonaldTrump,"especially how to get people, even with an unlimited budget, out to vote in the vital swing states ( and more). They focused on wrong states",40541,8641,,140x773584728276475905,9/7/16,2016,realDonaldTrump,#AmericaFirst! https://t.co/fQGxwAjXD7,25544,8639,AmericaFirst,14x762781418778791936,8/8/16,2016,realDonaldTrump,Thank you Newt!  https://t.co/Acg0hMvrpr,23926,8639,,40x809383989018497024,12/15/16,2016,realDonaldTrump,"Has anyone looked at the really poor numbers of @VanityFair Magazine. Way down, big trouble, dead! Graydon Carter, no talent, will be out!",35750,8634,,138x734485185148944384,5/22/16,2016,realDonaldTrump,The American people are sick and tired of not being able to lead normal lives and to constantly be on the lookout for terror and terrorists!,24226,8629,,140x761645207909568512,8/5/16,2016,realDonaldTrump,RT @DRUDGE_REPORT: FORMER HOSTAGE SAYS PLANE WAITED UNTIL MONEY ARRIVED... https://t.co/Uo0MS6w9OQ,0,8623,,98x778701067588472832,9/21/16,2016,realDonaldTrump,"Thank you Toledo, Ohio! It is so important for you to get out and VOTE on November 8, 2016! Lets MAKE AMERICA SAFE AND GREAT AGAIN! https://t.co/B8UVgfgRnQ",27083,8605,,131x793446442031575040,11/1/16,2016,realDonaldTrump,"JOIN ME TOMORROW IN FLORIDA!MIAMIäó¢12pmhttps://t.co/A3X71Q6sG2ORLANDOäó¢4pmhttps://t.co/6BqTVoty5CPENSACOLAäó¢7pmhttps://t.co/NaL9R3sWNg https://t.co/1cfccp8lVb",15884,8604,,140x763516489865523200,8/10/16,2016,realDonaldTrump,#MakeAmericaGreatAgain! https://t.co/8rWz6p1Ged,21069,8603,MakeAmericaGreatAgain,23x754301737431928832,7/16/16,2016,realDonaldTrump,"Crooked Hillary is spending big Wall Street money on ads saying I don't have foreign policy experience, yet look what her policies have done",24749,8598,,140x769980181633204224,8/28/16,2016,realDonaldTrump,RT @FoxNews: Poll: @realDonaldTrump vs. @HillaryClinton among white Evangelicals. https://t.co/6ohwIh1Q24,0,8591,,105x789207626143834112,10/20/16,2016,TeamTrump,"When Obama took office in 2009 employer-provided premiums cost $13,375. Today they are $18,142. Thanks, Obama.",17280,8590,,110x789223460853735425,10/20/16,2016,realDonaldTrump,"RT @TeamTrump: When Obama took office in 2009 employer-provided premiums cost $13,375. Today they are $18,142. Thanks, Obama.",0,8590,,125x788853838191075328,10/19/16,2016,realDonaldTrump,I am going to expand the definition of LOBBYIST - so we close all the LOOPHOLES! #DrainTheSwamp https://t.co/PBPrrEnfSK,19449,8587,DrainTheSwamp,95x759008377577967616,7/29/16,2016,realDonaldTrump,"Crooked Hillary Clinton made up facts about me, and ""forgot"" to mention the many problems of our country, in her very average scream!",30084,8587,,133x770253550639251456,8/29/16,2016,realDonaldTrump,"Now that African-Americans are seeing what a bad job Hillary type policy and management has done to the inner-cities, they want TRUMP!",26349,8578,,134x745296338758270976,6/21/16,2016,realDonaldTrump,Hillary Clinton's open borders immigration policies will drive down wages for all Americans - and make everyone less safe.,21437,8571,,122x729404337164783617,5/8/16,2016,realDonaldTrump,"Crooked Hillary just can't close the deal with Bernie. It will be the same way with ISIS, and China on trade, and Mexico at the border. Bad!",24064,8569,,140x753603401854881793,7/14/16,2016,realDonaldTrump,"Another new poll. Thank you for your support! Join the MOVEMENT today! #ImWithYou https://t.co/3KWOl2ibaW https://t.co/miT4atHxQz",22137,8567,ImWithYou,106x752591157641744384,7/11/16,2016,realDonaldTrump,"Thoughts and prayers with the victims, and their families- along with everyone at the Berrien County Courthouse in St. Joseph, Michigan.",27039,8562,,136x780598541441912832,9/27/16,2016,realDonaldTrump,".@HillaryClintonäó»s Nuclear Agreement Paved The Way For The $400 Million Ransom Payment #DebateNighthttps://t.co/qfZTx6aKYs",18500,8553,DebateNight,123x766805485466988544,8/20/16,2016,realDonaldTrump,.@Franklin_Graham @BillyNungesser @SamaritansPurse- so humbled by my time w/ you. You are in our thoughts &amp; prayers. https://t.co/I6xGsEzlwv,20892,8553,,120x761988164382756864,8/6/16,2016,realDonaldTrump,"Heading to New Hampshire - will be talking about Hillary saying her brain SHORT CIRCUITED, and other things!",27660,8540,,108x757205678821928960,7/24/16,2016,realDonaldTrump,"There is no longer a Bernie Sanders ""political revolution."" He is turning out to be a weak and somewhat pathetic figure,wants it all to end!",25417,8532,,140x760070280932982784,8/1/16,2016,realDonaldTrump,"Mr. Khan, who does not know me, viciously attacked me from the stage of the DNC and is now all over T.V. doing the same - Nice!",26719,8527,,127x747241330552737793,6/27/16,2016,realDonaldTrump,"""@LindaSuhler: Trump voters don't scare or back down. Our numbers are growing &amp; we're taking our country BACK. #Trump2016_ôˆ__ôˆŸ #MAGA",22449,8519,Trump2016 MAGA,133x783880036172623873,10/6/16,2016,realDonaldTrump,"Pennsylvania poll just released. Two rallies there on Mon- join me!Ambridge: https://t.co/TujWDWcgd3Wilkes-Barre: https://t.co/IL2nfQkVK1 https://t.co/iYixfg6VEl",17805,8515,,139x697051619427397633,2/9/16,2016,realDonaldTrump,MAKE AMERICA GREAT AGAIN!,15041,8487,,25x739998110915678208,6/7/16,2016,realDonaldTrump,A former Secret Service Agent for President Clinton excoriates Crooked Hillary describing her as ERRATIC &amp; VIOLENT. Bad temperament for pres,21107,8480,,144x757693383481626624,7/25/16,2016,realDonaldTrump,"Hard to believe that Bernie Sanders has done such a complete fold. He got NOTHING for all of the time, energy and money. The V.P. a joke!",28458,8478,,137x735968169001684992,5/26/16,2016,realDonaldTrump,"Today we, together, won the Republican Nomination for President! https://t.co/82l6TjA2lk",24221,8471,,88x781265981675036672,9/28/16,2016,realDonaldTrump,"Thank you Council Bluffs, Iowa! Will be back soon. Remember- everything you need to know about Hillary -- just #FollowTheMoney. https://t.co/Z6FQ3aXdEA",19357,8469,FollowTheMoney,127x768448216744488960,8/24/16,2016,realDonaldTrump,My thoughts and prayers are with the victims and families of those affected by two powerful earthquakes in Italy and Myanmar.,33047,8467,,125x759117301517996032,7/29/16,2016,realDonaldTrump,"""Only a Reagan or a Trump-like figure in the White House will achieve this goal."" https://t.co/6a7Ef12giZ",20820,8467,,105x708320551773851648,3/11/16,2016,realDonaldTrump,RT @RealBenCarson: Please read my full endorsement of @realDonaldTrump  for President of the United States: https://t.co/aSx9u3Ayz1.,0,8465,,132x732893573365010432,5/18/16,2016,realDonaldTrump,Bernie Sanders is being treated very badly by the Democrats - the system is rigged against him. Many of his disenfranchised fans are for me!,22788,8457,,140x700799986104029184,2/19/16,2016,realDonaldTrump,MAKE AMERICA GREAT AGAIN!,16658,8455,,25x751423658627829760,7/8/16,2016,realDonaldTrump,"Due to the horrific events taking place in our country, I have decided to postpone my speech on economic opportunity- today in Miami.",37953,8439,,133x761511930238496772,8/5/16,2016,realDonaldTrump,"The plane I saw on television was the hostage plane in Geneva, Switzerland, not the plane carrying $400 million in cash going to Iran!",26012,8435,,134x788035050118012928,10/17/16,2016,TeamTrump,"_ô_ÂBREAKING_ô_Â: ""State Department's Kennedy pressured FBI to unclassify Clinton emails: FBI documents""https://t.co/GYYaneeysA",13673,8434,,122